{
  "$schema"        : "../../docs/tableau.schema.json",
  "name"           : "Esdirk436L2Sa2",
  "description"    : "Pinned implicit Runge--Kutta tableau for Esdirk436L2Sa2.",
  "kind"           : "implicit-runge-kutta",
  "order"          : 4,
  "embedded_order" : 3,
  "A"              : [
    ["0.0", "0.0", "0.0", "0.0", "0.0", "0.0"],
    ["0.248", "0.248", "0.0", "0.0", "0.0", "0.0"],
    ["-0.05136248173426378", "-0.05136248173426378", "0.248", "0.0", "0.0", "0.0"],
    ["-0.0852828542665107", "-0.0852828542665107", "0.5339373380758116", "0.248", "0.0", "0.0"],
    ["-0.6896242166092131", "-0.6896242166092131", "1.5044770187873386", "0.6736944913541645", "0.248", "0.0"],
    ["-0.0024736542509845756", "-0.0024736542509845756", "0.3581348706213477", "0.4966739745362785", "-0.09786153665565701", "0.248"]
  ],
  "b"              : ["-0.0024736542509845756", "-0.0024736542509845756", "0.3581348706213477", "0.4966739745362785", "-0.09786153665565701", "0.248"],
  "c"              : ["0.0", "0.496", "0.14527503653147242", "0.6113716295427901", "1.0469230769230768", "1.0"],
  "error"          : ["0.08070224722689932", "0.08070224722689932", "-0.13429604627843", "-0.020089579465638774", "-0.025944248134872158", "0.018925379425142275"]
}
