{
  "$schema"        : "../../docs/tableau.schema.json",
  "name"           : "Sfsdirk8",
  "description"    : "Pinned implicit Runge--Kutta tableau for Sfsdirk8.",
  "kind"           : "implicit-runge-kutta",
  "order"          : 8,
  "embedded_order" : 7,
  "A"              : [
    ["0.050353353407", "0.0", "0.0", "0.0", "0.0", "0.0", "0.0", "0.0"],
    ["0.147724666662", "0.050353353407", "0.0", "0.0", "0.0", "0.0", "0.0", "0.0"],
    ["0.114455029802", "0.114455029802", "0.050353353407", "0.0", "0.0", "0.0", "0.0", "0.0"],
    ["0.114147680771", "0.114147680771", "0.14732797782", "0.050353353407", "0.0", "0.0", "0.0", "0.0"],
    ["0.114163314686", "0.114163314686", "0.147259379853", "0.14765588399", "0.050353353407", "0.0", "0.0", "0.0"],
    ["0.114163314686", "0.114163314686", "0.147259379853", "0.14765588399", "0.147724666662", "0.050353353407", "0.0", "0.0"],
    ["0.118472990244", "0.118472990244", "0.128349529304", "0.128695117609", "0.12875506777", "0.12875506777", "0.050353353407", "0.0"],
    ["0.118472990244", "0.118472990244", "0.128349529304", "0.128695117609", "0.12875506777", "0.12875506777", "0.147724666662", "0.050353353407"]
  ],
  "b"              : ["0.117592883046", "0.117592883046", "0.132211234288", "0.13256722045", "0.132628974356", "0.132293123539", "0.117556840638", "0.117556840638"],
  "c"              : ["0.050353353407", "0.198078020069", "0.279263413011", "0.425976692769", "0.573595246622", "0.721319913284", "0.801854116348", "0.94957878301"],
  "error"          : ["0.0", "0.0", "0.0", "0.0", "0.0", "0.0", "0.0", "0.0"]
}
