{
  "$schema": "../../docs/tableau.schema.json",
  "name": "Esdirk325L2Sa",
  "description": "Pinned implicit Runge--Kutta tableau for Esdirk325L2Sa.",
  "kind": "implicit-runge-kutta",
  "order": 3,
  "embedded_order": 2,
  "A": [
    ["0.0", "0.0", "0.0", "0.0", "0.0"],
    ["0.225", "0.225", "0.0", "0.0", "0.0"],
    ["0.2715990257669732", "0.2715990257669732", "0.225", "0.0", "0.0"],
    ["0.22374368670764583", "0.22374368670764583", "-0.07248737341529163", "0.225", "0.0"],
    ["0.17554550212940523", "0.17554550212940523", "-0.34685820002600626", "0.7707671957671958", "0.225"]
  ],
  "b": ["0.17554550212940523", "0.17554550212940523", "-0.34685820002600626", "0.7707671957671958", "0.225"],
  "c": ["0.0", "0.45", "0.7681980515339464", "0.6", "1.0"],
  "error": ["0.00880571988665399", "0.00880571988665399", "0.0686500159750193", "-0.07390518322387207", "-0.01235627252445512"]
}
