{
  "$schema": "../../docs/tableau.schema.json",
  "name": "SspRk53TwoN1",
  "description": "Fixed-step strong-stability-preserving SspRk53TwoN1 Runge--Kutta method.",
  "kind": "explicit-runge-kutta",
  "order": 3,
  "A": [
    [0, 0, 0, 0, 0],
    ["0.443_568_244_942_995_02", 0, 0, 0, 0],
    ["0.443_568_244_942_995_02", "0.291_111_420_073_766", 0, 0, 0],
    ["0.443_568_244_942_995_02", "0.291_111_420_073_766", "0.270_612_601_278_217_01", 0, 0],
    ["0.190_111_792_195_290_81", "0.124_769_332_407_580_91", "0.115_983_610_653_289_95", "0.110_577_759_392_786", 0]
  ],
  "b": ["0.190_111_792_195_290_81", "0.124_769_332_407_580_91", "0.115_983_610_653_289_95", "0.110_577_759_392_786", "0.458_557_505_351_052"],
  "c": ["0.0", "0.443_568_244_942_995", "0.734_679_665_016_762", "1.005_292_266_294_979", "0.541_442_494_648_948"]
}
