{
  "$schema": "../../docs/tableau.schema.json",
  "name": "SspRk104",
  "description": "Fixed-step strong-stability-preserving SspRk104 Runge--Kutta method.",
  "kind": "explicit-runge-kutta",
  "order": 4,
  "A": [
    [0, 0, 0, 0, 0, 0, 0, 0, 0, 0],
    ["1.0 / 6.0", 0, 0, 0, 0, 0, 0, 0, 0, 0],
    ["1.0 / 6.0", "1.0 / 6.0", 0, 0, 0, 0, 0, 0, 0, 0],
    ["1.0 / 6.0", "1.0 / 6.0", "1.0 / 6.0", 0, 0, 0, 0, 0, 0, 0],
    ["1.0 / 6.0", "1.0 / 6.0", "1.0 / 6.0", "1.0 / 6.0", 0, 0, 0, 0, 0, 0],
    ["1.0 / 15.0", "1.0 / 15.0", "1.0 / 15.0", "1.0 / 15.0", "1.0 / 15.0", 0, 0, 0, 0, 0],
    ["1.0 / 15.0", "1.0 / 15.0", "1.0 / 15.0", "1.0 / 15.0", "1.0 / 15.0", "1.0 / 6.0", 0, 0, 0, 0],
    ["1.0 / 15.0", "1.0 / 15.0", "1.0 / 15.0", "1.0 / 15.0", "1.0 / 15.0", "1.0 / 6.0", "1.0 / 6.0", 0, 0, 0],
    ["1.0 / 15.0", "1.0 / 15.0", "1.0 / 15.0", "1.0 / 15.0", "1.0 / 15.0", "1.0 / 6.0", "1.0 / 6.0", "1.0 / 6.0", 0, 0],
    ["1.0 / 15.0", "1.0 / 15.0", "1.0 / 15.0", "1.0 / 15.0", "1.0 / 15.0", "1.0 / 6.0", "1.0 / 6.0", "1.0 / 6.0", "1.0 / 6.0", 0]
  ],
  "b": ["1/10", "1/10", "1/10", "1/10", "1/10", "1/10", "1/10", "1/10", "1/10", "1/10"],
  "c": ["0.0", "1.0 / 6.0", "1.0 / 3.0", "1.0 / 2.0", "2.0 / 3.0", "1.0 / 3.0", "1.0 / 2.0", "2.0 / 3.0", "5.0 / 6.0", "1.0"]
}
