{
  "$schema": "../../docs/tableau.schema.json",
  "name": "SspRk73",
  "description": "Fixed-step strong-stability-preserving SspRk73 Runge--Kutta method.",
  "kind": "explicit-runge-kutta",
  "order": 3,
  "A": [
    [0, 0, 0, 0, 0, 0, 0],
    ["0.233_213_863_663_009", 0, 0, 0, 0, 0, 0],
    ["0.233_213_863_663_009", "0.233_213_863_663_009", 0, 0, 0, 0, 0],
    ["0.233_213_863_663_009", "0.233_213_863_663_009", "0.233_213_863_663_009", 0, 0, 0, 0],
    ["0.190_078_023_865_844_71", "0.190_078_023_865_844_71", "0.190_078_023_865_844_71", "0.190_078_023_865_845", 0, 0, 0],
    ["0.169_307_879_812_473_97", "0.095_884_917_878_143_7", "0.095_884_917_878_143_7", "0.095_884_917_878_143_84", "0.117_644_805_593_911_99", 0, 0],
    ["0.169_307_879_812_473_97", "0.095_884_917_878_143_7", "0.095_884_917_878_143_7", "0.095_884_917_878_143_84", "0.117_644_805_593_911_99", "0.233_213_863_663_009", 0]
  ],
  "b": ["0.176_989_315_165_324_43", "0.112_391_719_832_538_73", "0.112_391_719_832_538_73", "0.084_359_646_634_108_83", "0.103_504_017_606_329_38", "0.205_181_790_464_579", "0.205_181_790_464_579"],
  "c": ["0.0", "0.233_213_863_663_009", "0.466_427_727_326_018", "0.699_641_590_989_027", "0.760_312_095_463_379", "0.574_607_439_040_817", "0.807_821_302_703_826"]
}
