{
  "$schema"        : "../../docs/tableau.schema.json",
  "name"           : "Feagin10",
  "description"    : "Feagin tenth-order explicit Runge--Kutta method with an eighth-order estimator.",
  "kind"           : "explicit-runge-kutta",
  "order"          : 10,
  "embedded_order" : 8,
  "fsal"           : false,
  "A"              : [
    [0, 0, 0, 0, 0, 0, 0, 0, 0, 0, 0, 0, 0, 0, 0, 0, 0],
    ["0.10000000000000001", 0, 0, 0, 0, 0, 0, 0, 0, 0, 0, 0, 0, 0, 0, 0, 0],
    ["-0.91517656137529146", "1.4545344021782731", 0, 0, 0, 0, 0, 0, 0, 0, 0, 0, 0, 0, 0, 0, 0],
    ["0.20225919030111816", "0.0000000000000000", "0.60677757090335449", 0, 0, 0, 0, 0, 0, 0, 0, 0, 0, 0, 0, 0, 0],
    ["0.18402471470864357", "0.0000000000000000", "0.19796683122719236", "-0.072954784731363256", 0, 0, 0, 0, 0, 0, 0, 0, 0, 0, 0, 0, 0],
    ["0.087900734020668128", "0.0000000000000000", "0.0000000000000000", "0.41045970252026065", "0.48271375367886649", 0, 0, 0, 0, 0, 0, 0, 0, 0, 0, 0, 0],
    ["0.085970050490246031", "0.0000000000000000", "0.0000000000000000", "0.33088596304072221", "0.48966295730945020", "-0.073185637507085080", 0, 0, 0, 0, 0, 0, 0, 0, 0, 0, 0],
    ["0.12093044912533372", "0.0000000000000000", "0.0000000000000000", "0.0000000000000000", "0.26012467575829562", "0.032540262154909134", "-0.059578021181736100", 0, 0, 0, 0, 0, 0, 0, 0, 0, 0],
    ["0.11085437958039149", "0.0000000000000000", "0.0000000000000000", "0.0000000000000000", "0.0000000000000000", "-0.060576148825500560", "0.32176370560177842", "0.51048572560806305", 0, 0, 0, 0, 0, 0, 0, 0, 0],
    ["0.11205441475287900", "0.0000000000000000", "0.0000000000000000", "0.0000000000000000", "0.0000000000000000", "-0.14494277590286592", "-0.33326971909625669", "0.49926922955688008", "0.50950460892968608", 0, 0, 0, 0, 0, 0, 0, 0],
    ["0.11397678396418598", "0.0000000000000000", "0.0000000000000000", "0.0000000000000000", "0.0000000000000000", "-0.076881336420335691", "0.23952736032439065", "0.39777466236809461", "0.010755895687360746", "-0.32776912416401888", 0, 0, 0, 0, 0, 0, 0],
    ["0.079831452828019608", "0.0000000000000000", "0.0000000000000000", "0.0000000000000000", "0.0000000000000000", "-0.052032968680060306", "-0.057695414616854887", "0.19478191571210415", "0.14538492318832508", "-0.078294271035167076", "-0.11450329936109892", 0, 0, 0, 0, 0, 0],
    ["0.98511561016485727", "0.0000000000000000", "0.0000000000000000", "0.33088596304072221", "0.48966295730945020", "-1.3789648657484357", "-0.86116419502763564", "5.7842881363753724", "3.2880776198510357", "-2.3863390509313640", "-3.2547934248364392", "-2.1634354168642300", 0, 0, 0, 0, 0],
    ["0.89508029577163284", "0.0000000000000000", "0.19796683122719236", "-0.072954784731363256", "0.0000000000000000", "-0.85123623966200757", "0.39832011231853331", "3.6393726318103559", "1.5482287703983033", "-2.1222171470405371", "-1.5835039854532618", "-1.7156160828593627", "-0.024403640575012746", 0, 0, 0, 0],
    ["-0.91517656137529146", "1.4545344021782731", "0.0000000000000000", "0.0000000000000000", "-0.77733364364496826", "0.0000000000000000", "-0.091089566215517601", "0.0000000000000000", "0.0000000000000000", "0.0000000000000000", "0.0000000000000000", "0.0000000000000000", "0.091089566215517601", "0.77733364364496826", 0, 0, 0],
    ["0.10000000000000001", "0.0000000000000000", "-0.15717866579977116", "0.0000000000000000", "0.0000000000000000", "0.0000000000000000", "0.0000000000000000", "0.0000000000000000", "0.0000000000000000", "0.0000000000000000", "0.0000000000000000", "0.0000000000000000", "0.0000000000000000", "0.0000000000000000", "0.15717866579977116", 0, 0],
    ["0.18178130070009529", "0.67500000000000004", "0.34275815984718982", "0.0000000000000000", "0.25911121454832275", "-0.35827896671795206", "-1.0459489594088331", "0.93032784541562696", "1.7795095943170811", "0.10000000000000001", "-0.28254756953904409", "-0.15932735011997254", "-0.14551589464700151", "-0.25911121454832275", "-0.34275815984718982", "-0.67500000000000004", 0]
  ],
  "b"              : ["0.033333333333333333", "0.025000000000000001", "0.033333333333333333", "0.0000000000000000", "0.050000000000000003", "0.0000000000000000", "0.040000000000000001", "0.0000000000000000", "0.18923747814892350", "0.27742918851774317", "0.27742918851774317", "0.18923747814892350", "-0.040000000000000001", "-0.050000000000000003", "-0.033333333333333333", "-0.025000000000000001", "0.033333333333333333"],
  "c"              : ["0.0000000000000000", "0.10000000000000001", "0.53935784080298177", "0.80903676120447265", "0.30903676120447265", "0.98107419021979525", "0.83333333333333337", "0.35401736585680238", "0.88252766196473231", "0.64261575824032258", "0.35738424175967748", "0.11747233803526766", "0.83333333333333337", "0.30903676120447265", "0.53935784080298177", "0.10000000000000001", "1.0000000000000000"],
  "error"          : ["0.0000000000000000", "0.0027777777777777779", "0.0000000000000000", "0.0000000000000000", "0.0000000000000000", "0.0000000000000000", "0.0000000000000000", "0.0000000000000000", "0.0000000000000000", "0.0000000000000000", "0.0000000000000000", "0.0000000000000000", "0.0000000000000000", "0.0000000000000000", "0.0000000000000000", "-0.0027777777777777779", "0.0000000000000000"]
}
