{
  "$schema": "../../docs/tableau.schema.json",
  "name": "Msrk5",
  "description": "The fixed-step eight-stage, fifth-order Misha Stepanov Runge-Kutta method.",
  "kind": "explicit-runge-kutta",
  "order": 5,
  "fsal": true,
  "A": [
    ["0", "0", "0", "0", "0", "0", "0", "0", "0"],
    ["4.0 / 45.0", "0", "0", "0", "0", "0", "0", "0", "0"],
    ["1.0 / 30.0", "1.0 / 10.0", "0", "0", "0", "0", "0", "0", "0"],
    ["1.0 / 20.0", "0.0", "3.0 / 20.0", "0", "0", "0", "0", "0", "0"],
    ["1.0 / 2.0", "0.0", "-15.0 / 8.0", "15.0 / 8.0", "0", "0", "0", "0", "0"],
    ["-11.0 / 135.0", "0.0", "23.0 / 45.0", "-2.0 / 27.0", "8.0 / 45.0", "0", "0", "0", "0"],
    ["5.0 / 108.0", "0.0", "35.0 / 72.0", "-59.0 / 216.0", "-25.0 / 27.0", "3.0 / 2.0", "0", "0", "0"],
    ["31.0 / 128.0", "0.0", "-7563.0 / 4480.0", "233.0 / 112.0", "3461.0 / 2240.0", "-765.0 / 448.0", "153.0 / 320.0", "0", "0"],
    ["29.0 / 456.0", "0.0", "0.0", "11.0 / 38.0", "2.0 / 27.0", "11.0 / 40.0", "4.0 / 19.0", "224.0 / 2565.0", "0"]
  ],
  "b": ["29.0 / 456.0", "0.0", "0.0", "11.0 / 38.0", "2.0 / 27.0", "11.0 / 40.0", "4.0 / 19.0", "224.0 / 2565.0", "0.0"],
  "c": ["0.0", "4.0 / 45.0", "2.0 / 15.0", "1.0 / 5.0", "1.0 / 2.0", "8.0 / 15.0", "5.0 / 6.0", "19.0 / 20.0", "1.0"]
}
