{
  "$schema"     : "../../docs/tableau.schema.json",
  "name"        : "Alshina6",
  "description" : "The fixed-step optimal seven-stage, sixth-order Alshina method.",
  "kind"        : "explicit-runge-kutta",
  "order"       : 6,
  "A"           : [
    ["0", "0", "0", "0", "0", "0", "0"],
    ["0.571_428_571_428_571_4", "0", "0", "0", "0", "0", "0"],
    ["1.026_785_714_285_714_2", "-0.312_5", "0", "0", "0", "0", "0"],
    ["0.934_920_634_920_634_9", "0.277_777_777_777_777_8", "-0.355_555_555_555_555_57", "0", "0", "0", "0"],
    ["0.180_025_671_442_084_34", "0.147_379_406_839_616_14", "0.016_070_163_293_314_288", "-0.067_082_039_324_993_7", "0", "0", "0"],
    ["-0.079_797_658_566_031_38", "0.025_290_591_998_992_584", "-0.351_632_620_226_681_3", "0.320_729_490_168_751_6", "0.809_016_994_374_947_5", "0", "0"],
    ["0.498_859_935_619_735_2", "-0.863_349_994_193_042_9", "1.677_812_284_666_834_9", "-1.268_237_254_218_789_4", "-0.427_050_983_124_842_35", "1.381_966_011_250_105", "0"]
  ],
  "b"           : ["1.0 / 12.0", "0.0", "0.0", "0.0", "5.0 / 12.0", "5.0 / 12.0", "1.0 / 12.0"],
  "c"           : ["0.0", "0.571_428_571_428_571_4", "0.714_285_714_285_714_3", "0.857_142_857_142_857_1", "0.276_393_202_250_021", "0.723_606_797_749_978_9", "1.0"]
}
