{
  "$schema"        : "../../docs/tableau.schema.json",
  "name"           : "SspRk432",
  "description"    : "Adaptive four-stage, third-order SSPRK method with a second-order estimator and continuous extension.",
  "kind"           : "explicit-runge-kutta",
  "order"          : 3,
  "embedded_order" : 2,
  "A"              : [
    [0, 0, 0, 0],
    ["1/2", 0, 0, 0],
    ["1/2", "1/2", 0, 0],
    ["1/6", "1/6", "1/6", 0]
  ],
  "b"              : ["1/6", "1/6", "1/6", "1/2"],
  "c"              : [0, "1/2", 1, "1/2"],
  "error"          : ["-1/6", "-1/6", "-1/6", "1/2"],
  "dense"          : [
    [1, "-5/6"],
    [0, "1/6"],
    [0, "1/6"],
    [0, "1/2"]
  ]
}
