{
  "$schema": "../../docs/tableau.schema.json",
  "name": "Vern6",
  "description": "Verner's efficient embedded order-6 explicit Runge--Kutta method.",
  "kind": "explicit-runge-kutta",
  "order": 6,
  "embedded_order": 5,
  "fsal": true,
  "A": [
    [0, 0, 0, 0, 0, 0, 0, 0, 0],
    ["0.06", 0, 0, 0, 0, 0, 0, 0, 0],
    ["0.019239962962962962", "0.07669337037037037", 0, 0, 0, 0, 0, 0, 0],
    ["0.035975", "0.0", "0.107925", 0, 0, 0, 0, 0, 0],
    ["1.3186834152331484", "0.0", "-5.042058063628562", "4.220674648395414", 0, 0, 0, 0, 0],
    ["-41.87259166432751", "0.0", "159.43256216313748", "-122.11921356501004", "5.531743066200053", 0, 0, 0, 0],
    ["-54.430156935316504", "0.0", "207.06725136501848", "-158.61081378459", "6.991816585950242", "-0.01859723106220323", 0, 0, 0],
    ["-54.66374178728198", "0.0", "207.95280625538936", "-159.2889574744995", "7.018743740796944", "-0.018338785905045722", "-0.0005119484997882099", 0, 0],
    ["0.03438957868357036", "0.0", "0.0", "0.25826245556335037", "0.4209371189673537", "4.40539646966931", "-176.48311902429865", "172.36413340141507", 0]
  ],
  "b": ["0.03438957868357036", "0.0", "0.0", "0.25826245556335037", "0.4209371189673537", "4.40539646966931", "-176.48311902429865", "172.36413340141507", "0.0"],
  "c": ["0.0", "0.06", "0.09593333333333333", "0.1439", "0.4973", "0.9725", "0.9995", "1.0", "1.0"],
  "error": ["0.008623404282200854", "0.0", "0.0", "-0.019434029953152708", "0.028450072588037983", "-2.1097110610652914", "103.45854289996397", "-101.39980461914912", "0.03333333333333333"],
  "dense": [
    ["1.0", "-7.778593856495576", "27.0524385722671", "-45.780190114576975", "36.723777410436384", "-11.183042432947357"],
    ["0.0"],
    ["0.0"],
    ["0.0", "16.632102138279762", "-86.25583404770623", "171.73305461826962", "-149.67744091315947", "47.826380659879696"],
    ["0.0", "27.10835046149758", "-140.58676162962996", "279.90447579689163", "-243.95644583707966", "77.95131832728772"],
    ["0.0", "283.70753264670356", "-1471.3371557366656", "2929.3928569314394", "-2553.17199842168", "815.8141610498723"],
    ["0.0", "-11365.512865164834", "58942.74718938947", "-117353.43045697975", "102281.77209230464", "-32682.059078573824"],
    ["0.0", "11100.250191051131", "-57567.067013355576", "114614.48808378985", "-99894.591091309", "31919.283963225014"],
    ["0.0", "-3.0022825150732126", "14.946122435958785", "-27.826954732510288", "21.824672217437076", "-5.941557405812358"],
    ["0.0", "-19.610347376201034", "93.13370014508226", "-165.3493635542416", "129.73901617804057", "-37.91300539268019"],
    ["0.0", "-18.23029074639409", "96.74593449012313", "-199.08634973839895", "180.85605899200485", "-60.285352997334954"],
    ["0.0", "-13.563796638614157", "90.62137973668116", "-204.04515601697273", "190.48135937835858", "-63.493786459452856"]
  ],
  "lazy_dense_stages": [
    {
      "c": "0.5",
      "A": [
        {
          "stage": 0,
          "value": "0.016524159013572806"
        },
        {
          "stage": 3,
          "value": "0.3053128187514179"
        },
        {
          "stage": 4,
          "value": "0.2071200938201979"
        },
        {
          "stage": 5,
          "value": "-1.293879140655123"
        },
        {
          "stage": 6,
          "value": "57.11988411588149"
        },
        {
          "stage": 7,
          "value": "-55.87979207510932"
        },
        {
          "stage": 8,
          "value": "0.024830028297766014"
        }
      ]
    },
    {
      "c": "0.828",
      "A": [
        {
          "stage": 0,
          "value": "0.038150081818627744"
        },
        {
          "stage": 3,
          "value": "0.2502358252513705"
        },
        {
          "stage": 4,
          "value": "0.3249441447817608"
        },
        {
          "stage": 5,
          "value": "1.8224606658327962"
        },
        {
          "stage": 6,
          "value": "-67.7137233269262"
        },
        {
          "stage": 7,
          "value": "66.03587911808127"
        },
        {
          "stage": 8,
          "value": "-0.0363881087495127"
        },
        {
          "stage": 9,
          "value": "0.106441599909888"
        }
      ]
    },
    {
      "c": "0.28",
      "A": [
        {
          "stage": 0,
          "value": "0.11178168039666012"
        },
        {
          "stage": 3,
          "value": "0.025757505109345213"
        },
        {
          "stage": 4,
          "value": "3.785140856363646"
        },
        {
          "stage": 5,
          "value": "92.34088993695727"
        },
        {
          "stage": 6,
          "value": "-3819.461508432344"
        },
        {
          "stage": 7,
          "value": "3732.492711530704"
        },
        {
          "stage": 8,
          "value": "-1.0756940209963033"
        },
        {
          "stage": 9,
          "value": "-3.231539970732086"
        },
        {
          "stage": 10,
          "value": "-4.707539085458635"
        }
      ]
    }
  ]
}
