{
  "$schema": "../../docs/tableau.schema.json",
  "name": "Esdirk54I8L2Sa",
  "description": "Pinned implicit Runge--Kutta tableau for Esdirk54I8L2Sa.",
  "kind": "implicit-runge-kutta",
  "order": 5,
  "embedded_order": 4,
  "A": [
    ["0.0", "0.0", "0.0", "0.0", "0.0", "0.0", "0.0", "0.0"],
    ["0.25", "0.25", "0.0", "0.0", "0.0", "0.0", "0.0", "0.0"],
    ["0.30177669529663687", "0.30177669529663687", "0.25", "0.0", "0.0", "0.0", "0.0", "0.0"],
    ["0.1914039030905011", "0.1914039030905011", "-0.10280780618100219", "0.25", "0.0", "0.0", "0.0", "0.0"],
    ["0.28240705587394466", "0.28240705587394466", "-0.04126691018786242", "0.026452798439973117", "0.25", "0.0", "0.0", "0.0"],
    ["0.23835518790251256", "0.2552834985916606", "-0.19539385777416787", "0.018765913020685827", "0.11298925825930888", "0.25", "0.0", "0.0"],
    ["0.12371171764236197", "-0.30513942215186096", "-5.475399871109475", "2.9975825630620987", "9.742587241281745", "-6.333342228724871", "0.25", "0.0"],
    ["0.13369730938460478", "-0.20386397876250517", "-4.263238079373237", "2.4818742436204877", "7.606707292513777", "-4.985159097468383", "-0.02001768991474364", "0.25"]
  ],
  "b": ["0.13369730938460478", "-0.20386397876250517", "-4.263238079373237", "2.4818742436204877", "7.606707292513777", "-4.985159097468383", "-0.02001768991474364", "0.25"],
  "c": ["0.0", "0.5", "0.8535533905932737", "0.53", "0.8", "0.68", "1.0", "1.0"],
  "error": ["-0.01974701149998087", "-0.200277299222538", "-2.3971111035906025", "1.0198392221032249", "4.22381036593695", "-2.666100165539363", "0.5339736057291588", "-0.4943876139168489"]
}
