{
  "$schema"        : "../../docs/tableau.schema.json",
  "name"           : "ImexSsp3433",
  "description"    : "Pinned implicit Runge--Kutta tableau for ImexSsp3433.",
  "kind"           : "implicit-runge-kutta",
  "order"          : 3,
  "embedded_order" : 2,
  "A"              : [
    ["0.24169426078821", "0.0", "0.0", "0.0"],
    ["-0.24169426078821", "0.24169426078821", "0.0", "0.0"],
    ["0.0", "0.75830573921179", "0.24169426078821", "0.0"],
    ["0.06042356519705", "0.1291528696059", "0.06872930440884001", "0.24169426078821"]
  ],
  "b"              : ["0.0", "0.16666666666666666", "0.16666666666666666", "0.6666666666666666"],
  "c"              : ["0.24169426078821", "0.0", "1.0", "0.5"],
  "error"          : ["0.0", "0.0", "0.0", "0.0"]
}
