{
  "$schema": "../../docs/tableau.schema.json",
  "name": "Pdirk44",
  "description": "Fourth-order four-stage parallel diagonally implicit Runge-Kutta method.",
  "kind": "implicit-runge-kutta",
  "order": 4,
  "A": [
    ["1/2", 0, 0, 0],
    [0, "2/3", 0, 0],
    ["-5/2", "5/2", "1/2", 0],
    ["-5/3", "4/3", 0, "2/3"]
  ],
  "b": [-1, "3/2", -1, "3/2"],
  "c": ["1/2", "2/3", "1/2", "1/3"]
}
