{
  "$schema": "../../docs/tableau.schema.json",
  "name": "Psrk3p5q4",
  "description": "The fixed-step four-stage, third-order pseudo-symplectic Runge-Kutta method.",
  "kind": "explicit-runge-kutta",
  "order": 3,
  "A": [
    ["0", "0", "0", "0"],
    ["3.0 / 8.0", "0", "0", "0"],
    ["11.0 / 12.0", "-2.0 / 3.0", "0", "0"],
    ["-1.0 / 12.0", "11.0 / 6.0", "-3.0 / 4.0", "0"]
  ],
  "b": ["1.0 / 9.0", "8.0 / 9.0", "-2.0 / 9.0", "2.0 / 9.0"],
  "c": ["0.0", "3.0 / 8.0", "1.0 / 4.0", "1.0"]
}
