{
  "$schema"        : "../../docs/tableau.schema.json",
  "name"           : "OwrenZen5",
  "description"    : "The adaptive Owren-Zennaro 5/4 method with a fifth-order interpolant.",
  "kind"           : "explicit-runge-kutta",
  "order"          : 5,
  "embedded_order" : 4,
  "fsal"           : true,
  "A"              : [
    ["0", "0", "0", "0", "0", "0", "0", "0"],
    ["1.0 / 6.0", "0", "0", "0", "0", "0", "0", "0"],
    ["1.0 / 16.0", "3.0 / 16.0", "0", "0", "0", "0", "0", "0"],
    ["1.0 / 4.0", "-3.0 / 4.0", "1.0", "0", "0", "0", "0", "0"],
    ["-3.0 / 4.0", "15.0 / 4.0", "-3.0", "1.0 / 2.0", "0", "0", "0", "0"],
    ["369.0 / 1_372.0", "-243.0 / 343.0", "297.0 / 343.0", "1_485.0 / 9_604.0", "297.0 / 4_802.0", "0", "0", "0"],
    ["-133.0 / 4_512.0", "1_113.0 / 6_016.0", "7_945.0 / 16_544.0", "-12_845.0 / 24_064.0", "-315.0 / 24_064.0", "156_065.0 / 198_528.0", "0", "0"],
    ["83.0 / 945.0", "0.0", "248.0 / 825.0", "41.0 / 180.0", "1.0 / 36.0", "2_401.0 / 38_610.0", "6_016.0 / 20_475.0", "0"]
  ],
  "b"              : ["83.0 / 945.0", "0.0", "248.0 / 825.0", "41.0 / 180.0", "1.0 / 36.0", "2_401.0 / 38_610.0", "6_016.0 / 20_475.0", "0.0"],
  "c"              : ["0.0", "1.0 / 6.0", "1.0 / 4.0", "1.0 / 2.0", "1.0 / 2.0", "9.0 / 14.0", "7.0 / 8.0", "1.0"],
  "error"          : ["-188.0 / 945.0", "0.0", "752.0 / 825.0", "-89.0 / 45.0", "-1.0 / 9.0", "32_242.0 / 19_305.0", "-6_016.0 / 20_475.0", "0.0"],
  "dense"          : [
    ["1.0", "-3_292.0 / 819.0", "17_893.0 / 2_457.0", "-4_969.0 / 819.0", "596.0 / 315.0"],
    ["0.0", "0.0", "0.0", "0.0", "0.0"],
    ["0.0", "5_112.0 / 715.0", "-43_568.0 / 2_145.0", "1_344.0 / 65.0", "-1_984.0 / 275.0"],
    ["0.0", "-123.0 / 52.0", "3_161.0 / 234.0", "-1_465.0 / 78.0", "118.0 / 15.0"],
    ["0.0", "-63.0 / 52.0", "1_061.0 / 234.0", "-413.0 / 78.0", "2.0"],
    ["0.0", "-40_817.0 / 33_462.0", "60_025.0 / 50_193.0", "2_401.0 / 1_521.0", "-9_604.0 / 6_435.0"],
    ["0.0", "18_048.0 / 5_915.0", "-637_696.0 / 53_235.0", "96_256.0 / 5_915.0", "-48_128.0 / 6_825.0"],
    ["0.0", "-18.0 / 13.0", "75.0 / 13.0", "-109.0 / 13.0", "4.0"]
  ]
}
