{
  "$schema"        : "../../docs/tableau.schema.json",
  "name"           : "RKV76IIa",
  "description"    : "Verner RKV76.IIa seventh-order explicit Runge--Kutta pair.",
  "kind"           : "explicit-runge-kutta",
  "order"          : 7,
  "embedded_order" : 6,
  "fsal"           : false,
  "A"              : [
    [0, 0, 0, 0, 0, 0, 0, 0, 0, 0],
    ["0.069000000000000006", 0, 0, 0, 0, 0, 0, 0, 0, 0],
    ["0.017101449275362317", "0.10089855072463769", 0, 0, 0, 0, 0, 0, 0, 0],
    ["0.044249999999999998", "0.0000000000000000", "0.13275000000000001", 0, 0, 0, 0, 0, 0, 0],
    ["0.73534451307095661", "0.0000000000000000", "-2.8301606578569376", "2.5958161447859811", 0, 0, 0, 0, 0, 0],
    ["-12.215804853604080", "0.0000000000000000", "48.826654858237362", "-38.556155923199285", "2.7190858300965357", 0, 0, 0, 0, 0],
    ["108.86141887041765", "0.0000000000000000", "-432.45211817757780", "343.91152818001183", "-20.550411359252738", "1.2235824864010403", 0, 0, 0, 0],
    ["113.47551318837385", "0.0000000000000000", "-450.81220215559972", "358.51327651900897", "-21.450466676484456", "1.2740533186059528", "-0.0021741939046384228", 0, 0, 0],
    ["115.69962233242326", "0.0000000000000000", "-459.66354461002481", "365.55347171317459", "-21.885115863497848", "1.2987181096987215", "-0.000053187009184818837", "-0.0030984947647318645", 0, 0],
    ["124.15439356124647", "0.0000000000000000", "-493.23187133145973", "392.20862193158007", "-23.486415642908533", "1.3623229489089075", "-0.0070514673672057706", "0.0000000000000000", "0.0000000000000000", 0]
  ],
  "b"              : ["0.051635201720578693", "0.0000000000000000", "0.0000000000000000", "0.27671725354616489", "0.33741752852871509", "0.18844882678109678", "24.541341216348680", "-68.811902844690124", "44.416342817764885", "0.0000000000000000"],
  "c"              : ["0.0000000000000000", "0.069000000000000006", "0.11799999999999999", "0.17699999999999999", "0.50100000000000000", "0.77377991153053305", "0.99399999999999999", "0.99800000000000000", "1.0000000000000000", "1.0000000000000000"],
  "error"          : ["0.00073843588364921886", "0.0000000000000000", "0.0000000000000000", "-0.0026604839301584970", "0.0092845142540615710", "-0.035723295037518310", "23.753883738547174", "-68.811902844690124", "44.416342817764885", "0.67003711720802916"]
}
